id,titles
2021-02-17/texas-crisis-deepens-economic-fallout-spreads-energy-update,"Texas Crisis Deepens, Economic Fallout Spreads: Energy Update"
2021-02-17/covid-19-vaccination-tracker-charting-u-s-rates-by-race-demographics,U.S. Vaccine Data Reveal Big Racial Gaps in Who’s Getting Shots: Covid-19 Tracker
2021-02-17/at-93-she-waged-war-on-jpmorgan-and-two-financial-advisors-her-grandsons,"At 93, She Waged War on JPMorgan—and Her Own Grandsons"
2021-02-17/revlon-debacle-could-turn-citi-into-big-distressed-debt-investor,Citi May Get Stuck With Huge Chunk of Distressed Revlon Debt
2021-02-17/for-griffin-s-return-to-washington-citadel-is-a-bigger-target,"For Griffin’s Return to Washington, Citadel Is a ‘Bigger Target’"
2021-02-17/household-debt-climbs-to-record-in-u-s-amid-surge-in-mortgages,Household Debt Climbs to Record in U.S. Amid Surge in Mortgages
2021-02-17/rush-limbaugh-controversial-conservative-radio-host-dies-at-70,"Rush Limbaugh, Controversial Conservative Radio Host, Dies at 70"
2021-02-17/rise-of-retail-army-shrouds-half-of-stock-trading-in-secrecy,Rise of Retail Army Shrouds Half of Stock Trading in Secrecy
2021-02-17/uber-hires-prominent-critic-to-focus-on-treatment-of-drivers,Uber Hires Prominent Critic to Focus on Treatment of Drivers
2021-02-17/applebee-s-owner-says-it-found-formula-to-stand-out-on-ubereats,Applebee’s Owner Says It Found Formula to Stand Out on UberEats
2021-02-17/peloton-dominates-home-spinning-but-rival-won-t-let-it-say-so,Peloton Dominates Home Spinning But Rival Won’t Let It Say So
2021-02-15/astrazeneca-covid-vaccine-cleared-for-emergency-use-by-who,AstraZeneca Covid Vaccine Cleared for Emergency Use by WHO
2021-02-15/greece-tells-von-der-leyen-to-ensure-no-further-vaccine-delays,Greece Tells EU Chief to Prevent Further Vaccine Delays
2020-12-04/covid-19-vaccine-tracker-latest-updates-global-distribution,More Than 181 Million Shots Given: Covid-19 Vaccine Tracker
2021-02-17/the-big-dreams-of-a-nyc-to-boston-bullet-train,Is This High-Speed Train the First Megaproject of the Biden Era?
2021-02-17/how-plywood-from-boarded-up-stores-gets-reused,What Happens After the Plywood Comes Down
2021-02-16/citylab-daily-what-presidents-mean-when-they-talk-about-equity,CityLab Daily: What Presidents Mean When They Talk About Equity
2021-02-16/new-book-on-a-1970s-experiment-in-black-capitalism,How White Liberals Destroyed the 1970s’ Soul City
2021-02-16/post-covid-transit-needs-a-new-metric-for-success,"Post-Covid, Transit Agencies Must Look Beyond Ridership"
2021-02-17/what-biden-s-ev-plans-mean-for-a-korean-battery-fight-quicktake,What Biden’s EV Plans Mean for a Korean Battery Fight
2021-02-17/texas-crisis-deepens-economic-fallout-spreads-energy-update,"Texas Crisis Deepens, Economic Fallout Spreads: Energy Update"
2021-02-17/winter-storm-to-dump-snow-on-new-york-and-more-icy-rain-on-texas,Winter Storm to Dump Snow on New York and More Icy Rain on Texas
2021-02-17/nuclear-power-could-produce-a-third-of-u-k-s-hydrogen-by-2050,Nuclear Power Could Produce a Third of U.K.’s Hydrogen by 2050
2021-02-17/esg-funds-need-to-shrink-carbon-footprints-faster-green-insight,ESG Funds Need to Shrink Their Carbon Footprint Faster
2021-02-17/with-bitcoin-breaking-50-000-even-wall-street-skeptics-must-pay-attention,"With Bitcoin Breaking $50,000, Even Wall Street Skeptics Must Pay Attention"
2021-02-17/the-electrical-power-crash-is-just-like-a-stock-market-crash,The Electrical Power Crash Is Just Like a Stock Market Crash
2021-02-16/a-key-to-collaboration-is-not-being-afraid-to-suggest-bad-ideas,"How I Collaborate: Adi Goodrich, Creative Director and Spatial Designer"
2021-02-16/how-the-gop-could-rebuild-from-the-trump-earthquake,Oren Cass Urges Conservatives to Shed Free-Market ‘Orthodoxy’
2021-02-15/today-is-not-presidents-day-president-s-day-or-presidents-day,"Today Is Not Presidents’ Day, President’s Day, or Presidents Day"
2021-02-17/citi-can-t-have-its-900-million-back,Citi Can’t Have Its $900 Million Back
2021-02-17/stimulus-fueled-spending-in-january-bodes-well-for-retail-economy,"Have Stimulus, Will Spend"
2021-02-17/pennsylvania-s-awful-plan-to-gerrymander-judgeships,Pennsylvania’s Awful Plan to Gerrymander Judgeships
2021-02-17/mayor-bill-de-blasio-on-covid-19-and-new-york-city-s-future,A Conversation With the Mayor of New York
2021-02-17/pandemic-aid-four-reasons-the-states-need-help,Four Reasons the States Need Pandemic Aid
XB7LVydtTSmfEsdzFX5Wmg,Warren Buffett Reveals Three Stocks He Secretly Bought
_ea_SjIzQS2OgkNvV5XZOg,"At 93, She Waged War on JPMorgan—and Her Own Grandsons"
z7$FSIxtTRG_XItX7L6Oig,15 Million Without Power in Texas
906wU0riQeu$g2zd1P_h9g,"Bitcoin Is a 'Self-Fulfilling Bubble,' Roubini Warns"
NXhR3fQzT0KD8INQguGpdg,Watch the Trump Plaza Come Crashing Down
2021-02-17/one-third-of-u-s-troops-decline-covid-19-vaccine-pentagon-says,"One-Third of U.S. Troops Have Declined Covid Vaccine, Pentagon Says"
2021-02-17/hbo-max-adds-more-children-s-shows-in-pursuit-of-booming-disney,HBO Max Adds More Children’s Shows in Pursuit of Booming Disney+
2021-02-17/schumer-warren-challenge-biden-on-student-debt-cancellation,"Schumer, Warren Challenge Biden on Student Debt Cancellation"
2021-02-17/trump-brand-won-t-hurt-vornado-partnership-on-offices-ceo-says,"Trump Brand Won’t Hurt Vornado Partnership on Offices, CEO Says"
2021-02-17/texas-power-failure-shuts-chip-factories-squeezes-tight-supply,"Texas Power Failures Shut Chip Factories, Squeezing Tight Supply"
2021-02-17/-roaring-kitty-sued-for-securities-fraud-over-gamestop-rise,‘Roaring Kitty’ Sued for Securities Fraud Over GameStop Rise
2021-02-17/gasoline-use-plunged-as-americans-hunkered-down-during-cold-snap,Gasoline Use Plunged as Americans Hunkered Down During Cold Snap
2021-02-17/real-yields-rise-is-canary-in-the-coal-mine-for-risk-assets,Real Yields’ Rise Is Canary in the Coal Mine for Risk Assets
2021-02-17/u-s-economy-surges-into-2021-as-sales-output-top-forecasts,"U.S. Economy Surges Into 2021 as Sales, Output Top Forecasts"
2021-02-17/apple-s-electric-car-team-loses-key-manager-who-oversaw-sensors,Apple Loses Key Manager From Self-Driving Electric Car Team
2021-02-17/epic-games-attacks-apple-in-complaint-to-eu-antitrust-watchdog,Epic Games Attacks Apple in Antitrust Complaint to EU
2021-02-16/twitter-s-clash-with-india-government-gives-boost-to-local-rival,Twitter’s Clash With India Government Gives Boost to Local Rival
2021-02-16/twitter-climbs-to-new-high-as-advertising-market-recovers,Twitter Closes at Record as Advertising Market Recovers
2021-02-15/google-facebook-nearing-deals-to-pay-for-news-australia-says,"Google, Facebook Nearing Deals to Pay for News, Australia Says"
2021-02-17/schumer-warren-challenge-biden-on-student-debt-cancellation,"Schumer, Warren Challenge Biden on Student Debt Cancellation"
2021-02-17/u-s-to-start-with-a-few-million-j-j-vaccine-doses-if-authorized,U.S. Sees ‘Few Million’ Doses to Start Once J&J Vaccine Arrives
2021-02-17/black-cftc-candidate-calls-for-regulators-to-diversify-ranks,Georgetown’s Brummer Calls for Regulators to Diversify Ranks
2021-02-17/pelosi-bill-for-jan-6-riot-commission-could-come-this-week,Pelosi Bill for Jan. 6 Riot Commission Could Come This Week
2021-02-17/biden-administration-to-spend-1-6-billion-to-expand-covid-tests,Biden Administration to Spend $1.6 Billion to Expand Covid Tests
2021-02-17/with-bitcoin-breaking-50-000-even-wall-street-skeptics-must-pay-attention,"With Bitcoin Breaking $50,000, Even Wall Street Skeptics Must Pay Attention"
2021-02-17/microstrategy-raises-bonds-for-bitcoin-offering-to-1-05-billion,"MicroStrategy Boosts Bonds-for-Bitcoin Offering, Sets 0% Coupon"
jIIxh2ZES6W7giFBJLSZKA,What to Expect From the Crypto Market in 2020
2021-02-17/bitwise-launches-first-defi-fund-amid-boom-in-crypto-frontier,Bitwise Debuts First DeFi Fund Amid Boom in Crypto Frontier
2021-02-17/rich-americans-save-on-taxes-by-giving-away-wealth-that-grew-during-covid,Americans Who Made Fortunes During Covid Save on Taxes by Giving It Away
2021-02-17/sats-once-hailed-as-ivy-league-equalizers-fall-from-favor,"SATs, Once Hailed as Ivy League Equalizers, Fall From Favor"
2021-02-17/at-93-she-waged-war-on-jpmorgan-and-two-financial-advisors-her-grandsons,"At 93, She Waged War on JPMorgan—and Her Own Grandsons"
2021-02-17/how-to-talk-to-your-family-about-money-inheritance-and-wealth-to-avoid-fights,How to Keep Money From Destroying Your Family
2021-02-17/black-cftc-candidate-calls-for-regulators-to-diversify-ranks,Georgetown’s Brummer Calls for Regulators to Diversify Ranks
2021-02-17/rich-americans-save-on-taxes-by-giving-away-wealth-that-grew-during-covid,Americans Who Made Fortunes During Covid Save on Taxes by Giving It Away
2021-02-17/sats-once-hailed-as-ivy-league-equalizers-fall-from-favor,"SATs, Once Hailed as Ivy League Equalizers, Fall From Favor"
2021-02-17/uber-hires-prominent-critic-to-focus-on-treatment-of-drivers,Uber Hires Prominent Critic to Focus on Treatment of Drivers
2021-02-17/how-plywood-from-boarded-up-stores-gets-reused,What Happens After the Plywood Comes Down
2021-02-17/venture-capital-firm-taps-auto-execs-to-target-mobility-startups,Venture Capital Firm Taps Auto Execs to Scout Mobility Startups
2021-02-17/daimler-s-49-billion-issue-settling-mercedes-benz-brand-rights,Daimler’s $49 Billion Issue: Settling Mercedes-Benz Brand Rights
2021-02-17/mclaren-s-258-000-hybrid-boasts-blazing-speed-without-the-guilt,"McLaren’s $258,000 Hybrid Boasts Blazing Speed Without the Guilt"
2021-02-15/daimler-steps-up-profit-push-after-breakup-plan-boosts-shares,Daimler Steps Up Profit Push After Breakup Plan Boosts Shares
2021-02-17/schumer-warren-challenge-biden-on-student-debt-cancellation,"Schumer, Warren Challenge Biden on Student Debt Cancellation"
2021-02-17/citi-can-t-have-its-900-million-back,Citi Can’t Have Its $900 Million Back
2021-02-17/u-s-economy-surges-into-2021-as-sales-output-top-forecasts,"U.S. Economy Surges Into 2021 as Sales, Output Top Forecasts"
2021-02-17/stimulus-fueled-spending-in-january-bodes-well-for-retail-economy,"Have Stimulus, Will Spend"
